<?xml version="1.0" encoding="UTF-8" standalone="no"?>
<widget xmlns="http://samsung.widgetsdk.uievolution.com" xmlns:xsi="http://www.w3.org/2001/XMLSchema-instance" name="GpsTracking" xsi:schemaLocation="http://samsung.widgetsdk.uievolution.com http://samsung.widgetsdk.uievolution.com/projectConfig.xsd">
    <description/>
    <version>1.0</version>
    <width>400</width>
    <height>140</height>
    <icon>icon.png</icon>
    <main>index.html</main>
    <network>true</network>
    <defaultMode>fullscreen</defaultMode>
</widget>
